{
  "schema_version": "ISRAS-REPOSITORY-V1",
  "standard": {
    "repository": "Iron-Signal-Systems/engineering-standards",
    "commit": "UNPINNED-BOOTSTRAP"
  },
  "repository": "__REPOSITORY__",
  "canonical_origin": "__CANONICAL_ORIGIN__",
  "branches": {
    "development": "__DEVELOPMENT_BRANCH__",
    "release": "__RELEASE_BRANCH__"
  },
  "profiles": [
    "__PROFILE__"
  ],
  "validation": {
    "portable_shell": "./tools/validation/validate_portable.sh",
    "portable_powershell": "./tools/validation/Validate-Portable.ps1",
    "fresh_clone_shell": "./tools/validation/validate_fresh_clone.sh",
    "checkpoint_shell": "./tools/validation/validate_checkpoint.sh",
    "canonical_shell": "./tools/validation/validate_canonical.sh",
    "fresh_clone_powershell": "./tools/validation/Validate-FreshClone.ps1",
    "checkpoint_powershell": "./tools/validation/Validate-Checkpoint.ps1",
    "canonical_powershell": "./tools/validation/Validate-Canonical.ps1"
  },
  "checkpoint_registry": "tools/validation/checkpoints.json",
  "evidence_directory": "docs/acceptance/evidence",
  "documentation_sync_required": true,
  "historical_gates_immutable": true,
  "native_first": true,
  "containers_required": false,
  "direct_push_to_development_branch": false
}
